[
  {
    "id": "goban",
    "char": "npc_goban",
    "name": "Gobán Saor",
    "service": "wright",
    "captiveLine": "A broad-shouldered builder glares past you at his captors. \"I built halls for kings and they bind me with stone. Deal with these brutes and we'll talk.\"",
    "thanksLine": "The Gobán Saor rolls his shoulders and picks up his hammer like it never left his hand. \"A debt's a debt. Find me in the mounds below — I'll shape the stone to your liking.\"",
    "serviceFlavor": "The Gobán Saor sizes up the rift's falling stone with a builder's contempt. \"Bres sends rubble. Tell me what you need and I'll send you something with a shape to it.\""
  },
  {
    "id": "fedelm",
    "char": "npc_fedelm",
    "name": "Fedelm the Seeress",
    "service": "seer",
    "captiveLine": "A woman sits perfectly still among her captors, eyes closed, a cold blue flame guttering at her fingertips. \"I saw you coming,\" she murmurs. \"I saw them falling. Get on with it.\"",
    "thanksLine": "Fedelm opens her eyes at last. \"I see crimson on them, and none on you. Well cut. Look for me by the hearth — the future is easier to read out of the wind.\"",
    "serviceFlavor": "Fedelm turns her cold flame over in her hands, and shapes appear in it."
  },
  {
    "id": "bricriu",
    "char": "npc_bricriu",
    "name": "Bricriu of the Feast",
    "service": "cook",
    "captiveLine": "A man in a gold chain manages, somehow, to look put-upon rather than terrified. \"These gentlemen have no appreciation for hospitality. Remove them and my table is yours.\"",
    "thanksLine": "Bricriu straightens his chain and bows just slightly too deep to be sincere. \"My savior. Come to my table in the mounds — the Champion's Portion is yours by right, and I never poison the guest of honor.\"",
    "serviceFlavor": "Bricriu sweeps a hand over a table that wasn't there a moment ago — steam, fat, honey, and a cut of meat that is unmistakably the hero's."
  },
  {
    "id": "airmed",
    "char": "npc_airmed",
    "name": "Airmed the Herb-Wise",
    "service": "healer",
    "captiveLine": "A woman in healer's yellow kneels ringed by captors, hands bound behind her. \"They think my herbs will mend their king's ruined flesh. Cut them down and I'll tend to worthier wounds.\"",
    "thanksLine": "Airmed flexes her freed hands and is already assessing your bruises. \"Three hundred and sixty-five herbs grew from my brother's grave, and I remember every one my father scattered. Come to me in the mounds — flesh can always be made stronger.\"",
    "serviceFlavor": "Airmed's corner of the mound smells of yarrow, comfrey, and things that have no name above ground."
  },
  {
    "id": "abcan",
    "char": "npc_abcan",
    "name": "Abcán the Harper",
    "service": "harper",
    "captiveLine": "A small man sits cross-legged among his captors, gagged with iron chain. His eyes say: they gagged me for a reason. Kill them and hear why.",
    "thanksLine": "Abcán spits out the chain and hums one low note that makes the nearest stones lean in to listen. \"They gag the poet first, always. Find me by the hearth, friend — I owe you a lullaby your enemies will not enjoy.\"",
    "serviceFlavor": "Abcán tunes a harp strung with something brighter than wire. \"The suantraí,\" he says. \"The sleep-strain. I play it down the stair ahead of you, and what wakes there wakes slowly.\""
  }
]